{
  "$schema": "http://json-schema.org/draft-07/schema#",
  "type": "object",
  "properties": {
    "scenario_name": {
      "type": "string"
    },
    "scenario_note": {
      "type": "string"
    },
    "variability_configurations": {
      "type": "array",
      "items": {
        "type": "object",
        "properties": {
          "name": {
            "type": "string"
          },
          "use_normal_distribution": {
            "type": "boolean"
          },
          "uniform_time_variability": {
            "type": "number"
          },
          "uniform_energy_variability": {
            "type": "number"
          },
          "normal_dist_sigma_factor": {
            "type": "number"
          }
        },
        "required": [
          "name",
          "use_normal_distribution",
          "uniform_time_variability",
          "uniform_energy_variability",
          "normal_dist_sigma_factor"
        ]
      }
    },
    "factory": {
      "type": "object",
      "properties": {
        "storage_machines": {
          "type": "array",
          "items": {
            "type": "object",
            "properties": {
              "class": {
                "type": "string"
              },
              "name": {
                "type": "string"
              },
              "x": {
                "type": "number"
              },
              "y": {
                "type": "number"
              }
            },
            "required": [
              "class",
              "name",
              "x",
              "y"
            ]
          }
        },
        "processing_machines": {
          "type": "array",
          "items": {
            "type": "object",
            "properties": {
              "class": {
                "type": "string"
              },
              "name": {
                "type": "string"
              },
              "x": {
                "type": "number"
              },
              "y": {
                "type": "number"
              }
            },
            "required": [
              "class",
              "name",
              "x",
              "y"
            ]
          }
        },
        "transporter_machines": {
          "type": "array",
          "items": {
            "type": "object",
            "properties": {
              "class": {
                "type": "string"
              },
              "name": {
                "type": "string"
              },
              "from": {
                "type": "array",
                "items": {
                  "type": "string"
                }
              },
              "to": {
                "type": "array",
                "items": {
                  "type": "string"
                }
              }
            },
            "required": [
              "class",
              "name",
              "from",
              "to"
            ]
          }
        }
      },
      "required": [
        "storage_machines",
        "processing_machines",
        "transporter_machines"
      ]
    },
    "product": {
      "type": "object",
      "properties": {
        "class": {
          "type": "string"
        },
        "count": {
          "type": "integer"
        },
        "starting_location": {
          "type": "string"
        },
        "target_location": {
          "type": "string"
        },
        "params": {
          "type": "object",
          "properties": {
            "width": {
              "type": "number"
            },
            "height": {
              "type": "number"
            }
          },
          "required": [
            "width",
            "height"
          ]
        },
        "processing_tasks": {
          "type": "array",
          "items": {
            "type": "object",
            "properties": {
              "class": {
                "type": "string"
              },
              "params": {
                "type": "object",
                "additionalProperties": {
                  "type": "number"
                }
              }
            },
            "required": [
              "class",
              "params"
            ]
          }
        }
      },
      "required": [
        "class",
        "count",
        "starting_location",
        "target_location",
        "params",
        "processing_tasks"
      ]
    }
  },
  "required": [
    "variability_configurations",
    "factory",
    "product"
  ]
}
