{
  "scenario_name": "Plate A - 1S/2D/2C/2M/1A",
  "scenario_note": "Simple",
  "variability_configurations": [
    {
      "name": "default",
      "use_normal_distribution": false,
      "uniform_time_variability": 0.0,
      "uniform_energy_variability": 0.0,
      "normal_dist_sigma_factor": 0.0
    }
  ],
  "factory": {
    "storage_machines": [
      {
        "class": "StorageMachine",
        "name": "ST1",
        "x": 0.0,
        "y": 0.4,
        "skill_params": {
          "store_skill": {
            "time_factor": 1.0,
            "energy_factor": 1.0,
            "reliability": 1.0,
            "variability": "default"
          },
          "retrieve_skill": {
            "time_factor": 1.0,
            "energy_factor": 1.0,
            "reliability": 1.0,
            "variability": "default"
          }

        }
      }
    ],
    "processing_machines": [
      {
        "class": "MillingMachine",
        "name": "MM1",
        "x": 0.2,
        "y": 0.2,
        "skill_params": {
          "milling_skill": {
            "time_factor": 1.0,
            "energy_factor": 1.0,
            "reliability": 1.0,
            "variability": "default"
          }
        }
      },
      {
        "class": "MillingMachine",
        "name": "MM2",
        "x": 0.45,
        "y": 0.2,
        "skill_params": {
          "milling_skill": {
            "time_factor": 1.0,
            "energy_factor": 1.0,
            "reliability": 1.0,
            "variability": "default"
          }
        }
      },
      {
        "class": "CuttingMachine",
        "name": "CM1",
        "x": 0.7,
        "y": 0.5,
        "skill_params": {
          "cutting_skill": {
            "time_factor": 1.0,
            "energy_factor": 1.0,
            "reliability": 1.0,
            "variability": "default"
          }
        }
      },
      {
        "class": "CuttingMachine",
        "name": "CM2",
        "x": 0.7,
        "y": 0.3,
        "skill_params": {
          "cutting_skill": {
            "time_factor": 1.0,
            "energy_factor": 1.0,
            "reliability": 1.0,
            "variability": "default"
          }
        }
      },
      {
        "class": "DrillingMachine",
        "name": "DM1",
        "x": 0.2,
        "y": 0.6,
        "skill_params": {
          "drilling_skill": {
            "time_factor": 1.0,
            "energy_factor": 1.0,
            "reliability": 1.0,
            "variability": "default"
          }
        }
      },
      {
        "class": "DrillingMachine",
        "name": "DM2",
        "x": 0.45,
        "y": 0.6,
        "skill_params": {
          "drilling_skill": {
            "time_factor": 1.0,
            "energy_factor": 1.0,
            "reliability": 1.0,
            "variability": "default"
          }
        }
      }
    ],
    "transporter_machines": [
      {
        "class": "AutomatedGuidedVehicle",
        "name": "AGV1",
        "skill_params": {
          "transport_skill": {
            "time_factor": 1.0,
            "energy_factor": 1.0,
            "reliability": 1.0,
            "variability": "default"
          }
        },
        "from": ["*"],
        "to": ["*"]
      }
    ]
  },
  "product": {
    "class": "Plate",
    "count": 1,
    "starting_location": "ST1",
    "target_location": "ST1",
    "params": {
      "width": 125,
      "height": 100
    },
    "processing_tasks": [
      {
        "class": "DrillingTask",
        "name": "DT1",
        "preconditions": [],
        "params": {
          "center_x": 50,
          "center_y": 50,
          "radius": 15
        }
      },
      {
        "class": "MillingTask",
        "name": "MT1",
        "preconditions": [],
        "params": {
          "center_x": 0,
          "center_y": 100,
          "radius": 20
        }
      },
      {
        "class": "CuttingTask",
        "name": "CT1",
        "preconditions": [
          {"task_name": "DT1"}
        ],
        "params": {
          "start_x": 30,
          "start_y": 0,
          "end_x": 70,
          "end_y": 100
        }
      }
    ]
  }
}